{
  "id": "02-safety",
  "order": 2,
  "title": "السلامة أولاً",
  "subtitle": "أهم فصل في الكتاب — اقرئيه قبل أي عمل",
  "icon": "⚠️",
  "sections": [
    {
      "id": "intro",
      "type": "intro",
      "text": "قبل أن تنظفي أو تطبخي أي شيء، اعرفي هذه القواعد. هي تحميك وتحمي العائلة والأطفال. بعض هذه الأخطاء تسببت في حوادث حقيقية."
    },
    {
      "id": "chemicals",
      "type": "donts",
      "title": "المنظفات: لا تخلطي أبداً",
      "text": "كل منظف يُستخدم وحده. الخلط يُنتج غازاً ساماً قد يقتل في حمام مغلق.",
      "items": [
        {"icon": "☠️", "text": "لا تخلطي الكلوركس مع الفلاش أو أي منظف حمام.", "why": "ينتج غاز الكلور السام.", "level": "danger"},
        {"icon": "☠️", "text": "لا تخلطي الكلوركس مع الديتول أو الأمونيا أو الخل.", "level": "danger"},
        {"icon": "🪟", "text": "افتحي النافذة أو الباب عند استخدام أي منظف قوي.", "level": "warn"},
        {"icon": "🧤", "text": "البسي القفازات دائماً مع المنظفات.", "level": "warn"},
        {"icon": "🔒", "text": "خزّني المنظفات في مكان مرتفع ومغلق، بعيداً عن الأطفال والطعام.", "level": "danger"},
        {"icon": "🍼", "text": "لا تضعي أي منظف في زجاجة ماء أو عصير.", "why": "طفل قد يشربها.", "level": "danger"}
      ]
    },
    {
      "id": "kitchen",
      "type": "donts",
      "title": "المطبخ والغاز",
      "items": [
        {"icon": "🔥", "text": "أغلقي الغاز من المفتاح الرئيسي بعد الانتهاء من الطبخ، وقبل النوم.", "level": "danger"},
        {"icon": "👃", "text": "إذا شممتِ رائحة غاز: لا تشعلي النور أو الكهرباء. افتحي النوافذ واخرجي وأخبري العائلة فوراً.", "level": "danger"},
        {"icon": "🍳", "text": "لا تتركي الزيت على النار وتخرجي من المطبخ.", "why": "الزيت يشتعل بسرعة.", "level": "danger"},
        {"icon": "💧", "text": "إذا اشتعل الزيت: لا تصبّي عليه ماء أبداً. غطّيه بغطاء أو قماش مبلول وأغلقي الغاز.", "level": "danger"},
        {"icon": "🔌", "text": "لا تضعي أي معدن (ملعقة، ورق ألمنيوم) داخل المايكرويف.", "level": "warn"},
        {"icon": "🔪", "text": "احفظي السكاكين في الدرج أو الحامل، وليس في حوض الماء.", "why": "قد تجرحين يدك وأنتِ تغسلين."}
      ]
    },
    {
      "id": "electric",
      "type": "donts",
      "title": "الكهرباء والماء",
      "items": [
        {"icon": "⚡", "text": "لا تلمسي أي كهرباء ويدك مبلولة.", "level": "danger"},
        {"icon": "🔌", "text": "افصلي المكواة والمكنسة من الكهرباء بعد الاستخدام."},
        {"icon": "🚿", "text": "لا تدخلي أجهزة كهربائية (سشوار، جوال يشحن) إلى الحمام أثناء وجود ماء.", "level": "danger"},
        {"icon": "💦", "text": "نشّفي الأرض فوراً بعد المسح.", "why": "الأرض المبلولة تسبب سقوط الأطفال وكبار السن."}
      ]
    },
    {
      "id": "children",
      "type": "rules",
      "title": "الأطفال",
      "text": "الطفل لا يعرف الخطر. أنتِ عيونه.",
      "items": [
        {"icon": "👶", "text": "لا تتركي طفلاً صغيراً وحده في الحمام أو قرب الماء ولو لثانية.", "level": "danger"},
        {"icon": "🪟", "text": "أغلقي النوافذ والشبابيك في الغرف العالية. لا تضعي كرسياً أو سريراً تحت النافذة.", "level": "danger"},
        {"icon": "💊", "text": "الأدوية والمنظفات والأكياس البلاستيكية بعيدة عن يد الطفل.", "level": "danger"},
        {"icon": "🍬", "text": "لا تعطي الطفل أي أكل أو دواء دون إذن الأم.", "why": "قد يكون عنده حساسية."},
        {"icon": "🚗", "text": "لا تفتحي باب البيت لأي شخص غريب، ولا تسمحي للطفل بالخروج وحده."},
        {"icon": "🤲", "text": "ممنوع تماماً ضرب الطفل أو الصراخ عليه. إذا تعبتِ من الطفل، أخبري الأم.", "level": "danger"}
      ]
    },
    {
      "id": "emergency",
      "type": "phrases",
      "title": "في الطوارئ",
      "text": "احفظي هذه الأرقام والجمل.",
      "items": [
        {"icon": "🚑", "text": "الإسعاف والطوارئ في السعودية: 911"},
        {"icon": "📞", "text": "اتصلي بربة البيت أو رب البيت فوراً في أي حادث."},
        {"icon": "🗣️", "text": "قولي بالعربي: (في حادث! ساعدوني!)"},
        {"icon": "🗣️", "text": "قولي بالعربي: (الطفل مريض!)"},
        {"icon": "🗣️", "text": "قولي بالعربي: (في نار!)"},
        {"icon": "🗣️", "text": "قولي بالعربي: (ريحة غاز!)"}
      ]
    }
  ]
}
