{
  "id": "03-house-rules",
  "order": 3,
  "title": "قواعد البيت ونظافتك الشخصية",
  "subtitle": "كيف نعمل ونعيش معاً",
  "icon": "📋",
  "sections": [
    {
      "id": "intro",
      "type": "intro",
      "text": "هذه قواعد بسيطة تجعل العيش معاً سهلاً ومريحاً للجميع."
    },
    {
      "id": "personal",
      "type": "rules",
      "title": "نظافتك الشخصية",
      "text": "نظافتك جزء من نظافة البيت والطعام.",
      "items": [
        {"icon": "🚿", "text": "استحمّي كل يوم، خاصة قبل دخول المطبخ صباحاً."},
        {"icon": "🧼", "text": "اغسلي يديك بالصابون: قبل الطبخ، بعد الحمام، بعد لمس القمامة، بعد تغيير حفاض الطفل."},
        {"icon": "💅", "text": "الأظافر قصيرة ونظيفة دائماً. لا مناكير في المطبخ."},
        {"icon": "👩", "text": "الشعر مربوط أو مغطى أثناء الطبخ."},
        {"icon": "👕", "text": "ملابس العمل نظيفة كل يوم. لا تطبخي بالملابس التي نظفتِ بها الحمام."},
        {"icon": "🩹", "text": "إذا كان في يدك جرح، غطّيه بلاصق والبسي قفازاً قبل لمس الطعام."},
        {"icon": "🤧", "text": "إذا كنتِ مريضة بزكام أو إسهال، أخبري ربة البيت ولا تطبخي."}
      ]
    },
    {
      "id": "room",
      "type": "rules",
      "title": "غرفتك",
      "items": [
        {"icon": "🛏️", "text": "غرفتك مكانك الخاص. حافظي عليها نظيفة ومرتبة."},
        {"icon": "🚫", "text": "لا طعام مخزّن في الغرفة إلا في علبة مغلقة.", "why": "يجلب الحشرات."},
        {"icon": "🔇", "text": "الصوت هادئ في الليل."}
      ]
    },
    {
      "id": "belongings",
      "type": "donts",
      "title": "أشياء العائلة",
      "items": [
        {"icon": "💍", "text": "لا تلمسي المجوهرات أو الأموال أو الجوالات أو الأوراق. إذا وجدتِ شيئاً على الأرض، ضعيه على أقرب طاولة وأخبري ربة البيت.", "level": "danger"},
        {"icon": "🗄️", "text": "لا تفتحي الأدراج أو الدواليب الخاصة إلا إذا طُلب منك."},
        {"icon": "💔", "text": "إذا انكسر شيء بالخطأ، أخبرينا فوراً. لن نعاقبك على الصدق.", "why": "الإخفاء أسوأ من الكسر."},
        {"icon": "🍽️", "text": "لا تأخذي طعاماً من الثلاجة دون إذن. طعامك محدد ومتوفر لك دائماً."}
      ]
    },
    {
      "id": "visitors",
      "type": "donts",
      "title": "الباب والزوار",
      "items": [
        {"icon": "🚪", "text": "لا تفتحي الباب لأي شخص لا تعرفينه. اتصلي بربة البيت أولاً.", "level": "danger"},
        {"icon": "📦", "text": "طلبات التوصيل: استلمي عند الباب فقط، ولا تدخلي أحداً."},
        {"icon": "👥", "text": "لا تستقبلي زوّاراً لك في البيت دون إذن."}
      ]
    },
    {
      "id": "phone",
      "type": "rules",
      "title": "الجوال",
      "items": [
        {"icon": "📱", "text": "جوالك حقك، ولا يُؤخذ منك. لكن وقت العمل للعمل."},
        {"icon": "⏰", "text": "استخدمي الجوال في وقت الراحة، وفي غرفتك ليلاً."},
        {"icon": "📸", "text": "تذكّري: لا تصوير داخل البيت أبداً.", "level": "danger"}
      ]
    },
    {
      "id": "daily-times",
      "type": "schedule",
      "title": "أوقات يومنا (تُعدّل حسب البيت)",
      "items": [
        {"icon": "🌅", "text": "الاستيقاظ وبداية العمل: 7:00 صباحاً"},
        {"icon": "🍳", "text": "الفطور: 8:00"},
        {"icon": "☕", "text": "استراحة: 11:00 (30 دقيقة)"},
        {"icon": "🍛", "text": "الغداء والراحة: 2:00 – 4:00"},
        {"icon": "🌙", "text": "العشاء: 8:00"},
        {"icon": "🛌", "text": "انتهاء العمل: 10:00 مساءً"},
        {"icon": "📅", "text": "يوم الراحة الأسبوعي: الجمعة"}
      ]
    }
  ]
}
