{
  "id": "05-laundry",
  "order": 5,
  "title": "الغسيل والكوي",
  "subtitle": "حتى لا تفسد ملابس العائلة",
  "icon": "👕",
  "sections": [
    {
      "id": "intro",
      "type": "intro",
      "text": "الملابس غالية، وخطأ واحد في الغسيل قد يفسد ثوباً أو عباية. اتبعي هذه الخطوات بالترتيب."
    },
    {
      "id": "sort",
      "type": "steps",
      "title": "أولاً: الفرز",
      "items": [
        {"icon": "⚪", "text": "الأبيض وحده."},
        {"icon": "⚫", "text": "الأسود والألوان الغامقة وحدها (العبايات والأثواب السوداء)."},
        {"icon": "🌈", "text": "الألوان الفاتحة وحدها."},
        {"icon": "🧦", "text": "الملابس الداخلية والجوارب وحدها، وملابس الأطفال وحدها."},
        {"icon": "🛏️", "text": "المفارش والمناشف وحدها."},
        {"icon": "🏷️", "text": "اقرئي العلامة داخل الملابس: إذا فيها يد في ماء = غسيل يدوي. إذا فيها دائرة = تنظيف جاف (لا تغسليها)."},
        {"icon": "👜", "text": "فرّغي الجيوب. افتحي الأزرار والسحابات. اقلبي الملابس الغامقة على الداخل."}
      ]
    },
    {
      "id": "wash",
      "type": "steps",
      "title": "ثانياً: الغسيل",
      "items": [
        {"icon": "🌡️", "text": "الماء البارد أو 30 درجة لأغلب الملابس. الحار (60) للمناشف والمفارش البيضاء فقط."},
        {"icon": "🧴", "text": "الصابون: الكمية المكتوبة على العلبة، لا أكثر."},
        {"icon": "🚫", "text": "الكلوركس للأبيض فقط، وبكمية قليلة. أبداً على الملون أو الأسود.", "level": "danger"},
        {"icon": "🧕", "text": "العباية والحجاب والملابس الحساسة: برنامج ناعم (Delicate) أو باليد، ماء بارد، ولا تعصريها بقوة."},
        {"icon": "👶", "text": "ملابس الأطفال: صابون خاص للأطفال إذا كان متوفراً."},
        {"icon": "🧺", "text": "لا تملئي الغسالة أكثر من ثلاثة أرباع."}
      ]
    },
    {
      "id": "dry",
      "type": "steps",
      "title": "ثالثاً: التجفيف",
      "items": [
        {"icon": "☀️", "text": "الملابس الغامقة والعباية في الظل، لا تحت الشمس مباشرة.", "why": "الشمس تبهت اللون الأسود."},
        {"icon": "🌬️", "text": "النشافة: للمناشف والقطن فقط. لا للعباية ولا للملابس الحساسة ولا الصوف.", "level": "warn"},
        {"icon": "👔", "text": "علّقي القمصان والأثواب على علاّقة مباشرة بعد الغسيل حتى لا تتجعد."}
      ]
    },
    {
      "id": "iron",
      "type": "steps",
      "title": "رابعاً: الكوي",
      "items": [
        {"icon": "🌡️", "text": "درجة الحرارة حسب القماش: القطن والكتان حار. البوليستر والحرير منخفض. إذا لم تعرفي، ابدئي بمنخفض."},
        {"icon": "👘", "text": "الثوب الرجالي: الياقة أولاً، ثم الأكمام، ثم الجسم. يجب أن يكون بدون أي تجعيد."},
        {"icon": "🧕", "text": "العباية: من الداخل، بحرارة منخفضة، أو بقماشة بينها وبين المكواة."},
        {"icon": "🔌", "text": "افصلي المكواة بعد الانتهاء وضعيها واقفة حتى تبرد. لا تتركيها على القماش أبداً.", "level": "danger"},
        {"icon": "🧷", "text": "الطي: كل شخص ملابسه في دولابه. الجوارب أزواج."}
      ]
    },
    {
      "id": "stains",
      "type": "rules",
      "title": "البقع الشائعة",
      "items": [
        {"icon": "☕", "text": "القهوة والشاهي: ماء بارد فوراً، ثم صابون سائل، ثم غسيل عادي."},
        {"icon": "🩸", "text": "الدم: ماء بارد فقط (الحار يثبّت البقعة)، ثم صابون."},
        {"icon": "🍛", "text": "الزيت والدهون: صابون مواعين مباشرة على البقعة، انتظري 10 دقائق، ثم غسيل."},
        {"icon": "💄", "text": "المكياج: مزيل مكياج أو صابون سائل قبل الغسيل."},
        {"icon": "🖊️", "text": "الحبر: كحول أو معقم يدين على البقعة ثم غسيل."},
        {"icon": "❓", "text": "إذا لم تعرفي: لا تجربي شيئاً قوياً. اسألي ربة البيت."}
      ]
    }
  ]
}
