{
  "id": "01-welcome",
  "order": 1,
  "title": "أهلاً بك في بيتنا",
  "subtitle": "أول يوم لك معنا",
  "icon": "🏠",
  "sections": [
    {
      "id": "intro",
      "type": "intro",
      "text": "أهلاً بك. نحن سعداء بوجودك معنا. هذا الكتاب يشرح لك كيف نعيش في بيتنا، وماذا نحتاج منك، وكيف نحافظ على سلامتك وراحتك. اسمعي كل جملة بالضغط على زر الصوت، وخذي وقتك."
    },
    {
      "id": "first-days",
      "type": "tip",
      "title": "الأيام الأولى",
      "text": "في الأسبوع الأول لا نتوقع منك أن تعرفي كل شيء. راقبي، اسألي، وجرّبي. الخطأ في البداية طبيعي. المهم أن نتعلم معاً."
    },
    {
      "id": "family",
      "type": "rules",
      "title": "عائلتنا وخصوصيتها",
      "items": [
        {"icon": "🚪", "text": "اطرقي الباب قبل دخول أي غرفة، وانتظري الإذن.", "why": "الخصوصية مهمة جداً في بيوتنا."},
        {"icon": "📵", "text": "لا تصوّري أفراد العائلة أو داخل البيت أبداً.", "why": "هذا خط أحمر في السعودية وقد يسبب مشكلة قانونية.", "level": "danger"},
        {"icon": "🤫", "text": "ما يحدث في البيت يبقى في البيت. لا تتحدثي عن العائلة مع أحد خارج البيت."},
        {"icon": "👨", "text": "إذا كان في البيت رجال، احترمي المسافة، ولا تدخلي مجلس الرجال إلا إذا طُلب منك."},
        {"icon": "🧕", "text": "عند وجود ضيوف، البسي ملابس محتشمة ونظيفة."}
      ]
    },
    {
      "id": "prayer",
      "type": "rules",
      "title": "الصلاة وأوقاتها",
      "text": "نصلي خمس مرات في اليوم. عند سماع الأذان، العائلة قد تتوقف للصلاة.",
      "items": [
        {"icon": "🕌", "text": "لا تشغّلي المكنسة أو الخلاط أثناء الصلاة في البيت."},
        {"icon": "🧼", "text": "أماكن الصلاة والسجاد الخاص بالصلاة تبقى نظيفة دائماً ولا نمشي عليها بالأحذية."},
        {"icon": "🤲", "text": "إذا كنتِ مسلمة، لك الحق في وقت للصلاة. أخبري ربة البيت بأوقاتك."}
      ]
    },
    {
      "id": "communication",
      "type": "rules",
      "title": "كيف نتكلم مع بعض",
      "items": [
        {"icon": "❓", "text": "إذا لم تفهمي، قولي: (ما فهمت، من فضلك مرة ثانية). لا تقولي (نعم) وأنتِ لا تفهمين.", "why": "الفهم الخاطئ يسبب مشاكل أكبر من السؤال."},
        {"icon": "🙋", "text": "إذا كنتِ مريضة أو تعبانة، أخبرينا فوراً."},
        {"icon": "📱", "text": "استخدمي هذا الكتاب: ابحثي عن الجملة، واسمعيها بالعربي، أو أعطي الجوال لربة البيت لتسمع لغتك."}
      ]
    },
    {
      "id": "promise",
      "type": "intro",
      "title": "وعدنا لك",
      "text": "سنعاملك باحترام، ونعطيك راتبك في وقته، ويوم راحة كل أسبوع، ووقتاً للأكل والراحة والنوم. حقوقك مكتوبة في آخر فصل من هذا الكتاب."
    }
  ]
}
