{
  "id": "06-hospitality",
  "order": 6,
  "title": "الضيافة السعودية والمطبخ",
  "subtitle": "القهوة، الشاهي، الضيوف، والأكل اليومي",
  "icon": "☕",
  "sections": [
    {
      "id": "intro",
      "type": "intro",
      "text": "الضيافة عندنا شرف وعادة قديمة. الضيف يُكرَم من أول لحظة. هذا الفصل يعلّمك ما لا يعرفه إلا من عاش في السعودية."
    },
    {
      "id": "coffee",
      "type": "steps",
      "title": "القهوة السعودية",
      "text": "القهوة السعودية لونها فاتح (أشقر) ومعها هيل وأحياناً زعفران وقرنفل. تُقدَّم في فناجيل صغيرة من الدلة.",
      "items": [
        {"icon": "1️⃣", "text": "الطريقة الأساسية: لكل كوب ماء، ملعقة صغيرة قهوة سعودية (بن فاتح مطحون). اغلي الماء، أضيفي القهوة، اتركيها تغلي 10 دقائق على نار هادئة."},
        {"icon": "2️⃣", "text": "أضيفي الهيل المطحون (ملعقة صغيرة) وقليلاً من الزعفران، واتركيها دقيقتين، ثم ارفعيها."},
        {"icon": "3️⃣", "text": "صبّيها في الدلة (الترمس) بدون الرواسب."},
        {"icon": "🫖", "text": "كل بيت له طريقته. اسألي ربة البيت عن طريقتها وكميتها، واكتبيها أو صوّري المكونات."},
        {"icon": "🌡️", "text": "القهوة تُقدَّم حارة دائماً. إذا بردت، غيّريها."}
      ]
    },
    {
      "id": "serving",
      "type": "rules",
      "title": "آداب تقديم القهوة",
      "items": [
        {"icon": "🤚", "text": "الدلة باليد اليسرى والفنجان باليد اليمنى. قدّمي الفنجان باليد اليمنى دائماً.", "why": "التقديم باليسار يُعتبر غير مؤدب."},
        {"icon": "🥄", "text": "املئي ربع الفنجان فقط. لا تملئيه.", "why": "الفنجان الممتلئ يعني (لا نرحب بك)."},
        {"icon": "👴", "text": "ابدئي بالضيف الأكبر سناً أو الأهم (يجلس عادة في صدر المجلس)، ثم من على يمينه."},
        {"icon": "🔁", "text": "ابقي واقفة قريبة. إذا مدّ الضيف الفنجان الفارغ، أعيدي ملئه. إذا هزّ الفنجان يميناً ويساراً، يعني: شكراً، خذيه."},
        {"icon": "🌴", "text": "دائماً مع القهوة: التمر، أو الحلى، أو الشوكولاتة. لا تقدّمي القهوة وحدها."},
        {"icon": "🫖", "text": "بعد القهوة يأتي الشاهي. الشاهي في كاسات زجاج صغيرة (بيالة) مع السكر جانباً أو محلّى حسب البيت."},
        {"icon": "💧", "text": "قدّمي الماء في كاسات أو قوارير صغيرة، بارداً."}
      ]
    },
    {
      "id": "guests",
      "type": "steps",
      "title": "عندما يأتي ضيوف",
      "items": [
        {"icon": "1️⃣", "text": "قبل وصولهم: المجلس مرتب، الحمام الخارجي نظيف ومعطر، القهوة والشاهي جاهزان، الفناجيل والكاسات مغسولة."},
        {"icon": "2️⃣", "text": "عند الوصول: لا تفتحي الباب أنتِ إذا كان في البيت أحد من العائلة. إذا طُلب منك، افتحي وابتسمي وقولي: أهلاً وسهلاً."},
        {"icon": "3️⃣", "text": "بعد جلوسهم بخمس دقائق: القهوة والتمر. ثم الشاهي والحلى. ثم العصير أو الماء."},
        {"icon": "4️⃣", "text": "البخور (المبخرة): تُمرَّر على الضيوف بعد الأكل أو قبل خروجهم. احمليها بحذر، ومرّريها أمام كل ضيف ثوانٍ قليلة."},
        {"icon": "5️⃣", "text": "لا تجلسي في المجلس مع الضيوف. ابقي قريبة للخدمة."},
        {"icon": "6️⃣", "text": "بعد خروجهم: اجمعي الفناجيل، ونظفي المجلس فوراً ليكون جاهزاً."},
        {"icon": "🧕", "text": "ضيوف النساء: قد يخلعن العباية في الداخل. لا يدخل رجل، ولا تفتحي الباب لرجل، وأخبري النساء قبل دخول أي رجل من العائلة.", "level": "warn"}
      ]
    },
    {
      "id": "food-basics",
      "type": "rules",
      "title": "أساسيات المطبخ السعودي",
      "text": "الأكل عندنا حلال. لا لحم خنزير، ولا كحول، أبداً في أي طبخة.",
      "items": [
        {"icon": "🍚", "text": "الرز البسمتي هو الأساس: اغسليه 3 مرات، انقعيه 30 دقيقة، ثم اطبخيه. لكل كوب رز كوب ونصف ماء تقريباً."},
        {"icon": "🍗", "text": "الكبسة: رز + دجاج أو لحم + بهارات كبسة + بصل + طماطم + ليمون أسود (لومي). كل بيت له وصفته، تعلّميها من ربة البيت."},
        {"icon": "🥘", "text": "أطباق شائعة ستتعلمينها: الكبسة، المندي، المرقوق، الجريش، السليق، الإيدام (المرق)، الشوربة."},
        {"icon": "🌅", "text": "الفطور السعودي: شاهي بالحليب أو أحمر، خبز تميس أو توست، بيض، جبن، زيتون، فول، شكشوكة، عسل، تمر."},
        {"icon": "🍞", "text": "الخبز يُقدَّم حاراً. سخّنيه قبل التقديم."},
        {"icon": "🌶️", "text": "البهارات الأساسية: كمون، كزبرة، كركم، فلفل أسود، هيل، قرفة، لومي، بهارات مشكلة. تعرّفي على شكلها ورائحتها."},
        {"icon": "🥗", "text": "مع كل غداء: سلطة خضراء + دقوس (صلصة طماطم حارة) + لبن أو زبادي."}
      ]
    },
    {
      "id": "food-safety",
      "type": "donts",
      "title": "سلامة الطعام",
      "items": [
        {"icon": "🌡️", "text": "اللحم والدجاج يُطبخ جيداً حتى لا يبقى لون أحمر أو وردي في الداخل.", "level": "danger"},
        {"icon": "🔪", "text": "لوح تقطيع للحم ولوح آخر للخضار. اغسلي السكين بعد اللحم قبل الخضار."},
        {"icon": "🧊", "text": "الأكل المتبقي: يبرد، ثم في علبة مغلقة في الثلاجة، ويُؤكل خلال يومين. لا تتركي الأكل خارج الثلاجة أكثر من ساعتين."},
        {"icon": "❄️", "text": "لا تذوّبي اللحم المجمد على الطاولة. في الثلاجة من الليل، أو بالماء البارد."},
        {"icon": "🐔", "text": "اغسلي يديك جيداً بعد لمس الدجاج النيء."},
        {"icon": "👅", "text": "لا تذوقي الطعام بالملعقة ثم تعيديها للقدر. استخدمي ملعقة نظيفة كل مرة."}
      ]
    },
    {
      "id": "ramadan",
      "type": "rules",
      "title": "رمضان",
      "text": "شهر الصيام: العائلة لا تأكل ولا تشرب من الفجر إلى المغرب. المواعيد تتغير تماماً.",
      "items": [
        {"icon": "🌙", "text": "الفطور (الإفطار) عند المغرب: تمر + ماء + شوربة + سمبوسة + عصائر (فيمتو، قمر الدين) + الأطباق الرئيسية."},
        {"icon": "🌃", "text": "السحور قبل الفجر: أكل خفيف — فول، بيض، لبن، تمر، خبز."},
        {"icon": "😴", "text": "العائلة تنام متأخراً وتستيقظ متأخراً. أوقات عملك تتغير، اتفقي مع ربة البيت."},
        {"icon": "🤝", "text": "إذا لم تكوني مسلمة، لا تأكلي أو تشربي أمام الصائمين احتراماً لهم. أكلك متوفر لك في وقتك."},
        {"icon": "🧼", "text": "المطبخ في رمضان أكثر شغلاً. التنظيف الكبير يكون بعد الإفطار وقبل السحور."}
      ]
    }
  ]
}
