{
  "id": "07-phrasebook",
  "order": 7,
  "title": "القاموس الصوتي",
  "subtitle": "الجمل التي ستسمعينها كل يوم — اسمعيها وكرريها",
  "icon": "🗣️",
  "sections": [
    {
      "id": "intro",
      "type": "intro",
      "text": "هذه أكثر الجمل التي تقولها ربة البيت. اسمعي الجملة بالعربي، وافهمي معناها بلغتك. كرري حتى تحفظيها. وربة البيت تقدر تضغط على الجملة لتسمعك إياها بلغتك."
    },
    {
      "id": "daily",
      "type": "phrases",
      "title": "كلمات كل يوم",
      "items": [
        {"icon": "👋", "text": "السلام عليكم"},
        {"icon": "👋", "text": "صباح الخير"},
        {"icon": "🙏", "text": "شكراً"},
        {"icon": "🙏", "text": "الله يعطيك العافية (تُقال بعد إنجاز عمل)"},
        {"icon": "✅", "text": "طيب / تمام / أوكي"},
        {"icon": "🙋", "text": "نعم"},
        {"icon": "🙅", "text": "لا"},
        {"icon": "❓", "text": "ما فهمت"},
        {"icon": "🔁", "text": "مرة ثانية من فضلك"},
        {"icon": "⏳", "text": "دقيقة / لحظة"},
        {"icon": "✔️", "text": "خلصت (انتهيت)"},
        {"icon": "😔", "text": "آسفة / معليش"}
      ]
    },
    {
      "id": "commands",
      "type": "phrases",
      "title": "طلبات ربة البيت",
      "items": [
        {"icon": "🏃", "text": "تعالي"},
        {"icon": "⚡", "text": "بسرعة"},
        {"icon": "🐢", "text": "شوي شوي (ببطء / بهدوء)"},
        {"icon": "🧹", "text": "نظفي هذا"},
        {"icon": "🧽", "text": "امسحي"},
        {"icon": "🧺", "text": "اغسلي الملابس"},
        {"icon": "👕", "text": "اكوي الثوب"},
        {"icon": "🍽️", "text": "اغسلي المواعين"},
        {"icon": "🗑️", "text": "طلّعي الزبالة"},
        {"icon": "☕", "text": "سوّي قهوة"},
        {"icon": "🫖", "text": "سوّي شاهي"},
        {"icon": "🍚", "text": "سوّي رز"},
        {"icon": "🥤", "text": "جيبي ماء"},
        {"icon": "🛏️", "text": "رتّبي السرير / الغرفة"},
        {"icon": "👶", "text": "شوفي البيبي (راقبي الطفل)"},
        {"icon": "🚪", "text": "سكّري الباب (أغلقي الباب)"},
        {"icon": "🔓", "text": "افتحي"},
        {"icon": "💡", "text": "طفّي النور (أطفئي)"},
        {"icon": "💡", "text": "شغّلي النور"},
        {"icon": "❄️", "text": "شغّلي المكيف"},
        {"icon": "🔇", "text": "بدون صوت / اسكتي"},
        {"icon": "🛑", "text": "خلاص (يكفي / توقفي)"},
        {"icon": "🔍", "text": "وين؟ (أين؟)"},
        {"icon": "📍", "text": "هنا / هناك"}
      ]
    },
    {
      "id": "things",
      "type": "phrases",
      "title": "أسماء الأشياء",
      "items": [
        {"icon": "🧹", "text": "مكنسة"},
        {"icon": "🪣", "text": "مماسح / مسّاحة (ممسحة الأرض)"},
        {"icon": "🧴", "text": "صابون / كلوركس / فلاش / ديتول"},
        {"icon": "🧻", "text": "مناديل"},
        {"icon": "🫖", "text": "دلة (إبريق القهوة)"},
        {"icon": "☕", "text": "فنجال (كوب قهوة صغير)"},
        {"icon": "🥛", "text": "بيالة (كوب شاهي) / كاسة"},
        {"icon": "🍽️", "text": "صحن / ملعقة / شوكة / سكين"},
        {"icon": "🍲", "text": "قدر (حلة الطبخ)"},
        {"icon": "🧊", "text": "ثلاجة / فريزر"},
        {"icon": "🔥", "text": "طباخ (الفرن/الغاز)"},
        {"icon": "🧺", "text": "غسالة / نشافة"},
        {"icon": "🛋️", "text": "مجلس / صالة"},
        {"icon": "🚽", "text": "حمام / دورة مياه"},
        {"icon": "🛏️", "text": "غرفة / سرير / مخدة / بطانية / شرشف"},
        {"icon": "👘", "text": "ثوب (لبس الرجل) / عباية / شماغ / طرحة"},
        {"icon": "🌴", "text": "تمر / خبز / رز / لحم / دجاج"},
        {"icon": "🧴", "text": "بخور / مبخرة / عود"}
      ]
    },
    {
      "id": "family",
      "type": "phrases",
      "title": "أفراد العائلة",
      "items": [
        {"icon": "👩", "text": "ماما / مدام (ربة البيت)"},
        {"icon": "👨", "text": "بابا / الكفيل (رب البيت)"},
        {"icon": "👶", "text": "بيبي (الطفل الصغير)"},
        {"icon": "👧", "text": "البنت / الولد"},
        {"icon": "👵", "text": "جدة / أمي (الأم الكبيرة)"},
        {"icon": "👴", "text": "جد / أبوي"},
        {"icon": "👥", "text": "ضيوف"}
      ]
    },
    {
      "id": "you-say",
      "type": "phrases",
      "title": "جمل تقولينها أنتِ",
      "items": [
        {"icon": "🤒", "text": "أنا مريضة"},
        {"icon": "😴", "text": "أنا تعبانة"},
        {"icon": "🍽️", "text": "أنا جوعانة"},
        {"icon": "🚻", "text": "أروح الحمام؟"},
        {"icon": "❓", "text": "وين أحط هذا؟ (أين أضع هذا؟)"},
        {"icon": "💔", "text": "انكسر، آسفة"},
        {"icon": "🆘", "text": "ساعدوني!"},
        {"icon": "📞", "text": "أبي أكلم أهلي (أريد الاتصال بأهلي)"},
        {"icon": "💰", "text": "الراتب؟"},
        {"icon": "📅", "text": "يوم الإجازة؟"}
      ]
    },
    {
      "id": "numbers",
      "type": "phrases",
      "title": "الأرقام والوقت",
      "items": [
        {"icon": "1️⃣", "text": "واحد، اثنين، ثلاثة، أربعة، خمسة"},
        {"icon": "6️⃣", "text": "ستة، سبعة، ثمانية، تسعة، عشرة"},
        {"icon": "🕐", "text": "الساعة كم؟"},
        {"icon": "🌅", "text": "الصبح / الظهر / العصر / المغرب / الليل"},
        {"icon": "📅", "text": "اليوم / بكرة (غداً) / أمس"},
        {"icon": "📆", "text": "السبت، الأحد، الاثنين، الثلاثاء، الأربعاء، الخميس، الجمعة"}
      ]
    }
  ]
}
