{
  "id": "04-cleaning",
  "order": 4,
  "title": "التنظيف غرفة بغرفة",
  "subtitle": "الطريقة الصحيحة لكل مكان في البيت",
  "icon": "🧹",
  "sections": [
    {
      "id": "golden",
      "type": "rules",
      "title": "القواعد الذهبية للتنظيف",
      "items": [
        {"icon": "⬇️", "text": "ابدئي من الأعلى إلى الأسفل: الغبار أولاً، ثم الأسطح، ثم الأرض.", "why": "حتى لا يسقط الغبار على ما نظفتِه."},
        {"icon": "🔄", "text": "ابدئي من الداخل إلى الخارج: من أبعد نقطة في الغرفة إلى الباب."},
        {"icon": "🧽", "text": "لكل مكان قطعة قماش خاصة: الحمام لونها مختلف عن المطبخ. لا تخلطي بينها أبداً.", "why": "حتى لا تنقلي البكتيريا من الحمام إلى المطبخ.", "level": "warn"},
        {"icon": "💧", "text": "لا تصبّي الماء مباشرة على الأثاث أو الخشب أو الكهرباء. بلّلي القماش ثم امسحي."},
        {"icon": "🧴", "text": "المنظف القليل يكفي. الكثير يترك بقعاً ويحتاج شطفاً أكثر."},
        {"icon": "🪟", "text": "افتحي النوافذ عشر دقائق كل صباح لتغيير الهواء."}
      ]
    },
    {
      "id": "kitchen",
      "type": "steps",
      "title": "المطبخ (كل يوم)",
      "items": [
        {"icon": "1️⃣", "text": "اجمعي الأطباق المتسخة واغسليها بالماء الحار والصابون، ثم جففيها وأعيديها لمكانها."},
        {"icon": "2️⃣", "text": "امسحي سطح الطباخ والرخام بقماشة مبلولة ومنظف مطبخ، ثم بقماشة جافة."},
        {"icon": "3️⃣", "text": "امسحي واجهة الثلاجة والفرن والمايكرويف من الخارج."},
        {"icon": "4️⃣", "text": "نظفي الحوض بالمنظف، وامسحي حوله، ونظفي فتحة التصريف."},
        {"icon": "5️⃣", "text": "أخرجي القمامة كل ليلة، وضعي كيساً جديداً، وامسحي السلة إذا اتسخت."},
        {"icon": "6️⃣", "text": "اكنسي الأرض ثم امسحيها بماء ومنظف أرضيات. نشّفيها."},
        {"icon": "7️⃣", "text": "أعيدي كل شيء إلى مكانه. المطبخ ينتهي مرتباً قبل النوم."}
      ]
    },
    {
      "id": "kitchen-weekly",
      "type": "steps",
      "title": "المطبخ (كل أسبوع)",
      "items": [
        {"icon": "🧊", "text": "الثلاجة: أخرجي الأكل القديم (اسألي قبل رمي أي شيء)، امسحي الأرفف بماء وخل مخفف."},
        {"icon": "🔥", "text": "الفرن من الداخل: بعد أن يبرد تماماً، بمنظف فرن، والبسي قفازات."},
        {"icon": "🌀", "text": "المايكرويف من الداخل: وعاء ماء وليمون دقيقتين، ثم امسحي."},
        {"icon": "🗄️", "text": "واجهات الدواليب ومقابضها."},
        {"icon": "🪣", "text": "سلة القمامة من الداخل بالماء والصابون."}
      ]
    },
    {
      "id": "bathroom",
      "type": "steps",
      "title": "الحمامات (كل يوم)",
      "text": "البسي القفازات. استخدمي قماش الحمام فقط (اللون المخصص).",
      "items": [
        {"icon": "1️⃣", "text": "ضعي منظف الحمام في المرحاض واتركيه 5 دقائق، ثم افركي بالفرشاة من الداخل، وامسحي المقعد والغطاء والخارج."},
        {"icon": "2️⃣", "text": "نظفي المغسلة والصنبور والمرآة بمنظف زجاج."},
        {"icon": "3️⃣", "text": "نظفي أرض الحمام وجدران الدش من الصابون المتراكم."},
        {"icon": "4️⃣", "text": "غيّري المناشف إذا كانت رطبة أو متسخة، وأعيدي ورق التواليت والصابون."},
        {"icon": "5️⃣", "text": "نشّفي الأرض تماماً. الحمام ينتهي جافاً ورائحته نظيفة."},
        {"icon": "⚠️", "text": "تذكري: لا تخلطي منظف المرحاض مع الكلوركس أبداً.", "level": "danger"}
      ]
    },
    {
      "id": "bedrooms",
      "type": "steps",
      "title": "غرف النوم",
      "items": [
        {"icon": "1️⃣", "text": "اطرقي الباب. لا تدخلي غرفة والشخص نائم إلا إذا طُلب منك."},
        {"icon": "2️⃣", "text": "افتحي الستائر والنافذة قليلاً."},
        {"icon": "3️⃣", "text": "رتّبي السرير: شدّي الملاءة، رتّبي المخدات، اطوي الغطاء."},
        {"icon": "4️⃣", "text": "الملابس على الأرض أو الكرسي: النظيفة اطويها، والمتسخة إلى سلة الغسيل. إذا لم تعرفي، اسألي."},
        {"icon": "5️⃣", "text": "امسحي الغبار عن الطاولات والكومودينو والتلفزيون بقماشة جافة أو مبلولة قليلاً."},
        {"icon": "6️⃣", "text": "اكنسي أو استخدمي المكنسة الكهربائية، ثم امسحي الأرض."},
        {"icon": "🔄", "text": "غيّري ملاءات السرير مرة كل أسبوع (أو حسب ما تطلب ربة البيت)."}
      ]
    },
    {
      "id": "majlis",
      "type": "steps",
      "title": "المجلس والصالة",
      "text": "المجلس هو مكان استقبال الضيوف. يجب أن يكون جاهزاً دائماً.",
      "items": [
        {"icon": "1️⃣", "text": "رتّبي المخدات والوسائد وانفضيها."},
        {"icon": "2️⃣", "text": "امسحي الغبار عن الطاولات والرفوف والتحف بحذر. التحف الزجاجية بيد واحدة تحت وأخرى فوق."},
        {"icon": "3️⃣", "text": "نظفي شاشة التلفزيون بقماشة ميكروفايبر جافة فقط. لا ماء ولا منظف.", "level": "warn"},
        {"icon": "4️⃣", "text": "المكنسة الكهربائية للسجاد والكنب."},
        {"icon": "5️⃣", "text": "امسحي الأرض. تأكدي أن أدوات القهوة والدلة نظيفة وفي مكانها."},
        {"icon": "🌸", "text": "رشّي معطر جو خفيف أو بخّور إذا طلبت ربة البيت."}
      ]
    },
    {
      "id": "floors",
      "type": "rules",
      "title": "أنواع الأرضيات والأسطح",
      "items": [
        {"icon": "⬜", "text": "الرخام: ماء + منظف رخام أو صابون خفيف فقط. لا خل، لا ليمون، لا كلوركس.", "why": "الحموضة تأكل الرخام وتترك بقعاً لا تزول.", "level": "warn"},
        {"icon": "🟫", "text": "الباركيه والخشب: قماشة مبلولة قليلاً جداً. الماء الكثير يفسد الخشب.", "level": "warn"},
        {"icon": "🔲", "text": "السيراميك والبورسلان: ماء ومنظف أرضيات عادي."},
        {"icon": "🟥", "text": "السجاد: مكنسة كهربائية. البقع: ماء وصابون خفيف بقماشة، اضغطي لا تفركي."},
        {"icon": "✨", "text": "الستانلس ستيل (الثلاجة، الحنفيات): امسحي مع اتجاه الخطوط بقماشة ميكروفايبر. لا سلك خشن.", "why": "السلك يخدش."},
        {"icon": "🪞", "text": "الزجاج والمرايا: منظف زجاج وقماشة جافة أو ورق جرائد."}
      ]
    },
    {
      "id": "monthly",
      "type": "checklist",
      "title": "مرة كل شهر",
      "items": [
        {"icon": "💡", "text": "الإنارات والنجف (بعد إطفاء الكهرباء وبرودها)."},
        {"icon": "❄️", "text": "فلاتر المكيفات: اغسليها بالماء وجففيها."},
        {"icon": "🪟", "text": "النوافذ من الداخل والخارج (الآمنة فقط، لا تخرجي من نافذة عالية).", "level": "danger"},
        {"icon": "🚪", "text": "الأبواب والمقابض والمفاتيح الكهربائية."},
        {"icon": "🧱", "text": "الجدران من البقع بقماشة مبلولة."},
        {"icon": "🌀", "text": "مراوح الشفط في المطبخ والحمام."},
        {"icon": "🛋️", "text": "تحت الكنب والأسرة والسجاد."}
      ]
    }
  ]
}
