{
  "id": "08-rights",
  "order": 8,
  "title": "حقوقك وواجباتك",
  "subtitle": "حسب نظام العمالة المنزلية السعودي — وزارة الموارد البشرية",
  "icon": "⚖️",
  "sections": [
    {
      "id": "intro",
      "type": "intro",
      "text": "القانون السعودي يحميك ويحمي العائلة. هذه حقوقك وواجباتك كما كتبتها الحكومة. العائلة التي أعطتك هذا الكتاب تحترم هذه القواعد."
    },
    {
      "id": "rights",
      "type": "rules",
      "title": "حقوقك",
      "items": [
        {
          "icon": "💰",
          "text": "راتبك يُدفع كاملاً في نهاية كل شهر، بالطريقة المكتوبة في العقد."
        },
        {
          "icon": "⏰",
          "text": "لا تعملين أكثر من 10 ساعات عمل فعلي في اليوم."
        },
        {
          "icon": "☕",
          "text": "بعد كل 5 ساعات عمل، لك راحة 30 دقيقة على الأقل للأكل والصلاة."
        },
        {
          "icon": "😴",
          "text": "لك 8 ساعات راحة متواصلة على الأقل كل يوم (للنوم)."
        },
        {
          "icon": "📅",
          "text": "لك يوم راحة كامل كل أسبوع (24 ساعة متواصلة) بأجر كامل. إذا عملتِ فيه، لك يوم بديل أو تعويض."
        },
        {
          "icon": "🏖️",
          "text": "بعد سنتين عمل: إجازة 30 يوماً مدفوعة، أو تعويض عنها."
        },
        {
          "icon": "🤒",
          "text": "إجازة مرضية حتى 30 يوماً في السنة بتقرير طبي: أول 15 يوماً بأجر كامل، والـ15 التالية بنصف الأجر."
        },
        {
          "icon": "🏥",
          "text": "لك تأمين صحي وعلاج."
        },
        {
          "icon": "🛏️",
          "text": "لك سكن مناسب وطعام مناسب."
        },
        {
          "icon": "🛂",
          "text": "جواز سفرك وأوراقك حقك أنتِ. لا يجوز لأحد أن يحتفظ بها.",
          "level": "warn"
        },
        {
          "icon": "📞",
          "text": "لك الحق في الاتصال بأهلك وبسفارة بلدك."
        },
        {
          "icon": "🤝",
          "text": "لا يجوز تكليفك بعمل خطير على صحتك أو كرامتك، ولا بالعمل عند غير كفيلك."
        },
        {
          "icon": "🧪",
          "text": "فترة التجربة 90 يوماً كحد أقصى. خلالها يمكن لأي طرف إنهاء العقد."
        }
      ]
    },
    {
      "id": "duties",
      "type": "rules",
      "title": "واجباتك",
      "items": [
        {
          "icon": "✅",
          "text": "تأدية العمل المتفق عليه بإتقان وأمانة."
        },
        {
          "icon": "🙏",
          "text": "احترام العائلة والالتزام بتعليماتها المشروعة."
        },
        {
          "icon": "🔒",
          "text": "الحفاظ على ممتلكات البيت وأسرار العائلة."
        },
        {
          "icon": "🚫",
          "text": "عدم العمل لدى أي شخص آخر، وعدم الغياب أو الهروب.",
          "why": "الهروب يُعرّضك لغرامة وترحيل ومنع من العودة."
        },
        {
          "icon": "🕌",
          "text": "احترام الدين الإسلامي وعادات المجتمع السعودي."
        }
      ]
    },
    {
      "id": "help",
      "type": "phrases",
      "title": "إذا احتجتِ مساعدة",
      "text": "إذا تعرضتِ لمشكلة كبيرة (ضرب، عدم دفع الراتب، حجز)، لك الحق في التبليغ.",
      "items": [
        {
          "icon": "📱",
          "text": "تطبيق مساند للعامل المنزلي (Musaned Laborer) — مجاني، بلغتك، للشكاوى والاستفسارات."
        },
        {
          "icon": "☎️",
          "text": "الرقم الموحد لوزارة الموارد البشرية: 19911"
        },
        {
          "icon": "☎️",
          "text": "منصة مساند (العمالة المنزلية): 920002866"
        },
        {
          "icon": "🚨",
          "text": "الطوارئ (شرطة/إسعاف/حريق): 911"
        },
        {
          "icon": "🏛️",
          "text": "سفارة بلدك في الرياض أو قنصليتها في جدة."
        }
      ]
    },
    {
      "id": "closing",
      "type": "intro",
      "title": "كلمة أخيرة",
      "text": "أنتِ الآن جزء من بيتنا. نتمنى لك عملاً مريحاً، وأن تكون هذه التجربة خيراً لك ولأهلك. بالصدق والاحترام من الطرفين، سنعيش معاً بسلام. أهلاً وسهلاً بك."
    }
  ]
}